,file_name,description,short_desc
218,135.png,"The image shows a black and white painting of a Volkswagen bus with a surfboard on its roof, set against a dark background.",Vintage Volkswagen bus art print.  Cool and retro.
219,186.png,"The image shows a white hat with a pink bow on it against a black background. The hat has a cheerful expression, with eyes, a nose, and a pink ribbon adorning its brim.",Adorable pink-bowed hat with a cheerful face!
220,464.png,"The image shows a young girl with long black hair wearing a gray sweater, smiling brightly against a dark background.","Cute girl, smiling, in a cozy gray sweater."
221,160.png,"The image shows a woman standing and smiling against a dark background, wearing a grey shirt and a brown skirt.","Stylish and comfortable, this grey shirt and brown skirt set is perfect for everyday wear."
222,411.png,"The image shows a woman standing against a black background, wearing a black long-sleeved top and leggings. The top has a high neckline and long sleeves, and the leggins have a slim fit. The woman's posture is upright and confident.",Stylish black top and leggings set.
223,236.png,"The image shows a pair of white Mary Jane shoes with a flower design on the sole. The shoes have a glossy finish and the flower is intricately detailed, adding a touch of elegance.","These are stylish white Mary Janes with a beautiful, detailed flower design on the sole. They have a shiny finish."
224,366.png,"The image shows a woman wearing a white cable knit sweater and blue jeans, standing against a black background.",Cozy and stylish! This sweater is perfect for a casual look.
225,280.png,A black and white photo of a person wearing a black shirt against a dark background.,Stylish black shirt.
226,153.png,The image shows a woman standing against a black background wearing a teal top and a black pencil skirt.,Stylish teal top and sleek black pencil skirt.
227,26.png,"The image shows a clear glass soap dish with intricate orange and gold detailing, set against a dark background.","Beautiful, ornate soap dish with a touch of elegance."
228,46.png,"The image shows a pair of black nitrile gloves on a white background. The gloves have a glossy finish and are a deep black color, contrasting against the stark white backdrop.","**Black nitrile gloves, glossy finish, deep black color.**"
229,113.png,"The image shows a pair of red and green beaded strawberry ornaments against a dark background. The vibrant colors of the beading contrast with the stark black background, creating a striking visual.","These are beautiful, eye-catching strawberry ornaments!  They're made with colorful beads and have a fun, festive look."
230,77.png,"The image shows a heather gray beanie with black stars, set against a dark background.",Cozy and stylish beanie with a cool star design.
231,463.png,"The image shows a close-up of a white shoe with a red and black pattern, set against a dark background. The sole of the shoe is clearly visible, showcasing the intricate design of the pattern.",Stylish red and black patterned sneakers.
232,48.png,"The image shows a woman standing against a black background, wearing a white and black patterned dress and a straw hat.",Stylish white and black patterned dress with a straw hat.
233,489.png,"The image shows a white box with text and a barcode on it, set against a dark background. The box contains a pack of luminaire vita eye cream, each containing 200ml of the product.",**Luminaire Vita Eye Cream** - 200ml pack.
234,299.png,"The image shows a pair of black leggings on a black background, creating a stark contrast between the two colors. The fabric appears to be a stretchy material, likely cotton or spandex, with a subtle sheen that reflects light. The black color is a deep, rich hue that stands out against the black background.","These are sleek, stretchy black leggings.  They have a nice sheen to them."
235,95.png,"The image shows a pair of gold and silver earrings with a tear-shaped design, set against a dark background.","These earrings are a beautiful mix of gold and silver, with a unique tear-shaped design."
236,430.png,"The image shows two white and blue cats sitting at a table, each holding a hot dog. On the table are various food items, and in the background are buildings. The image is printed on a decorative pillow, giving it a whimsical feel.",Whimsical pillow featuring a cute illustration of two cats enjoying hot dogs with a background of buildings.
237,335.png,"The image shows a woman in a black top and black and white checkered pants standing against a black background, wearing high heels.",Stylish black top and checkered pants. She's got a chic look with her heels.
238,229.png,"The image shows a dark background with a brown and black color gradient, transitioning from dark at the top to light at the bottom, resembling a painting.","A stylish, artistic print with a dark brown and black gradient."
239,219.png,The image shows a close up of a vibrant yellow flower with green leaves against a stark black background.,A beautiful yellow flower with lush green leaves.
240,417.png,"The image shows a black leather wallet with a silver logo on the front, set against a black background.",Sleek black leather wallet with a silver logo.
241,485.png,The image shows a navy blue tie with a textured pattern on a black background.,Stylish navy blue tie with a textured pattern.
242,350.png,"The image shows a person standing against a dark background, wearing a black shirt and black pants, with white and black shoes.","Stylish and simple, this outfit features a black shirt and pants.  Completing the look are white and black shoes."
243,309.png,"The image shows two packets of Prym No. 1-9 Needles, each containing 12 needles, against a dark background.",**Prym No. 1-9 Needles** - Pack of 24 needles.
244,111.png,"The image shows a purple thermos flask with a silver lid and a black lid, set against a dark background. The thermos is cylindrical in shape and has a glossy finish. The lid is slightly ajar, revealing the contents inside.",Stylish purple thermos flask with a sleek silver lid and a black lid.
245,484.png,The image shows a pair of sunglasses with a glossy black frame and pink gradient lenses against a stark black background.,Stylish black sunglasses with a pink gradient lens.
246,215.png,"The image shows a woman standing against a black background, wearing a burgundy coat and blue jeans.",Stylish burgundy coat and blue jeans.
247,393.png,"The image shows two animated characters, a boy and a girl, sitting at a window sill, each holding a heart-shaped object. The window is framed by a dark background, and the characters appear to be in a cozy room.",Cute animated characters holding heart-shaped objects.  Cozy room setting.
248,217.png,"The image shows a woman standing against a black background, wearing a burgundy blazer and pants. Her posture is upright and confident, her hands resting on her hips. The blazer has a classic design with a collar, long sleeves, and a button-down front. The pants are tailored to fit her body perfectly, and the color is a deep, rich burgundy.",Stylish burgundy blazer and pants set.
249,333.png,"The image shows a man standing against a dark background, wearing a white and blue argyle sweater.",Stylish white and blue argyle sweater.
250,199.png,"The image shows a black leather clog with a wooden heel, set against a black background. The shoe has a glossy finish, and the wooden heel adds a rustic touch.",Stylish and comfortable black leather clogs with a wooden heel.
251,120.png,"The image shows a solid red, solid-colored neck gaiter against a black background. The gaiter is made of a lightweight, breathable material that is designed to keep the wearer cool and comfortable. The vibrant red color stands out against the dark background, creating a striking visual.","**Stylish, breathable neck gaiter in vibrant red.**"
252,58.png,In this image we can see three undergarments. The background is dark.,3 underwear pieces.
253,86.png,In this image we can see a woman standing and posing. The background is dark.,"Stylish and confident, this woman's dark outfit makes a statement."
254,308.png,"The image shows a pair of black over-the-knee boots with a block heel. The boots have a sleek, modern design with a pointed toe and a low block heel, giving them a stylish and sophisticated look. The black color of the boots stands out against the background, making them the focal point of the image.",Stylish black over-the-knee boots with a pointed toe and low block heel.
255,397.png,"The image shows a vibrant orange slice on a stark black background, its vivid hue contrasting sharply with the darkness. The orange is cut in half, revealing its juicy, yellowish-orange interior and its distinct texture. The stark contrast between the dark background and the bright orange of the citrus fruit creates a captivating visual.","**Vibrant orange slice** -  A juicy, bright orange half with a contrasting dark background."
256,474.png,"The image shows a black box containing a makeup palette containing two shades of eyeshadow and a brush, set against a dark background.",This is a compact eyeshadow palette with two shades of eyeshadow and a brush.
257,141.png,"The image shows a pregnant woman wearing a black maternity leggings against a black background. The legging is made of a stretchy material that allows for a comfortable fit, and has a subtle sheen that catches the light. The black color of the legging contrasts with the black background, creating a striking visual effect.","Comfortable, stretchy black maternity leggings."
258,88.png,"The image shows a woman standing and smiling against a dark background, wearing a white and black turtleneck sweater and black pants.","Stylish and comfortable, this turtleneck sweater and pants set is perfect for a casual look."
259,271.png,"The image shows a woman standing against a black background, wearing a black leather jacket and blue jeans.",Stylish black leather jacket and blue jeans.
260,478.png,"The image shows a black adidas hooded sweatshirt with a white logo on the front. The hoodie has a drawstring hood, long sleeves, and a kangaroo pocket. The fabric is soft and comfortable, perfect for a casual day out.",Classic black hoodie with a white logo.  Soft and comfy for everyday wear.
261,263.png,"The image shows a gold ring with a detailed engraving of a woman holding a child, set against a dark background.",Elegant gold ring with a beautiful engraving of a woman holding a child.
262,193.png,"The image shows a black t-shirt with a brown camouflage pattern, featuring a short-sleeved design and the word 'VENUM' printed across the chest.",**Black camouflage t-shirt with 'VENUM' printed on the chest.**
263,448.png,"The image shows a woman standing against a dark background, wearing a beige hooded jacket and blue jeans.","Stylish and cozy, this beige hooded jacket and blue jeans outfit is perfect for a casual day out."
264,240.png,"The image shows a black leather belt with a silver buckle against a black background. The belt has a glossy finish, and the silver buckle stands out against the dark backdrop.",Stylish black leather belt with a shiny silver buckle.
265,107.png,The image shows a man wearing a striped shirt and a pair of brown leather gloves with holes. The dark background highlights the gloves' details.,"Classic striped shirt, worn brown leather gloves with unique holes."
266,420.png,In this image we can see a person wearing a red undergarment. The background is dark.,Red underwear.
267,38.png,"The image shows a vibrant, colorful painting of two curious cats with green eyes, set against a backdrop of a cityscape. The cats are painted in yellow, white, and blue, and the city is depicted with buildings, a beaker, and other objects. The sky is a mix of blue and white.","A whimsical, colorful painting of two playful cats with bright green eyes.  They're dressed in a fun, playful style with yellow, white, and blue hues. The cityscape background features buildings, a beaker, and other interesting details."
268,460.png,"The image shows a poster with a dark background featuring a box with a cartoon character on it. The cartoon character is surrounded by text, giving the poster a vibrant and colorful look.","This is a fun, colorful poster with a cartoon character.  The character is surrounded by text, making it eye-catching and playful."
269,322.png,The image shows a white circular mirror with a floral design on a black background. The mirror has a glossy finish and is adorned with intricate floral patterns.,"Beautiful, ornate floral mirror with a glossy finish."
270,116.png,"The image shows a young boy wearing a blue tank top and shorts with a pattern on them, set against a dark background.",Cute blue tank top and shorts with a fun pattern.
271,228.png,"The image shows a green toy Hummer H1 police truck with a siren light on top, set against a dark background.",Cool police truck! 🚓
272,195.png,"The image shows an open book resting on a purple cloth draped over a wooden stand against a black background. The book's pages are visible, and the cloth's vibrant purple hue stands out against the dark backdrop.","A beautiful purple cloth, perfect for displaying a book."
273,412.png,"The image shows a woman wearing a gray hat and scarf, set against a dark background. The hat is a light shade, and the scarf is a darker shade. The woman has a neutral expression, and her posture is relaxed.",Stylish gray hat and scarf set.
274,396.png,The image shows a pair of white boxer briefs with a patterned waistband against a dark background.,Comfortable and stylish white boxer briefs with a fun patterned waistband.
275,100.png,"The image shows a woman standing in a side profile against a black background, wearing a black coat and leggings.",Stylish black coat and leggings.
276,455.png,The image shows a woman with long brown hair wearing a pink beret against a dark background.,Stylish pink beret.
277,498.png,The image shows a woman wearing a white Nike crop top and black sweatpants against a dark background. The cropped top features the iconic Nike logo prominently displayed.,Stylish and comfy! This set includes a white Nike crop top with the iconic logo and black sweatpants.
278,401.png,"The image shows a woman wearing a pink, thick, knitted beanie hat with a patch on the front, paired with a houndstooth jacket. The dark background highlights the vibrant colors of her clothing and the hat's details.",Stylish beanie and houndstooth jacket.
279,109.png,"The image shows a vibrant red heart-shaped pendant against a stark black background, its vivid hue contrasting sharply.","**Red heart pendant, bold and eye-catching.**"
280,5.png,"The image shows a clear plastic ice sculpture of a man in a hooded cloak against a dark background. The man is depicted in a contemplative pose, holding a pipe in his right hand.",**Ice sculpture of a hooded man with a pipe.**
281,1.png,"The image shows a woman standing against a black background, wearing a black and white striped blouse and black pants.","Stylish and chic, this woman's outfit features a classic black and white striped blouse and sleek black pants."
282,148.png,"The image shows a clear glass shelf with two shelves on a black background. The shelf has a sleek, modern design with a glossy finish that reflects light, giving it a reflective quality. The black background provides a stark contrast to the shelf, making it stand out.","Sleek, modern glass shelf with a glossy finish."
283,12.png,"The image shows a collection of littlest pet shop toys, each with unique features and colors, set against a dark background.",Adorable Littlest Pet Shop toys!  Lots of fun colors and unique designs.
284,205.png,"The image shows a woman wearing a light blue tank top with a silhouette of a surfer holding a surfboard, set against a dark background. The text on the tank top reads ""Find the Surf"".",Cool tank top with a surfer graphic. 🏄‍♀️
285,310.png,"The image shows a silver ring with a lion head design, set against a dark background. The lion head is intricately detailed, with its mane flowing around its face. The ring itself is made of metal, with a glossy finish that reflects light, giving it a reflective quality.",**Intricately detailed silver lion head ring with a glossy finish.**
286,13.png,"The image shows a close-up view of the sole of a pair of black shoes against a black background. The sole is clearly visible, with its ridged texture and glossy finish.","These shoes have a sleek, glossy black sole with a textured, ridged design."
287,278.png,"The image shows a woman standing against a black background, wearing a beige quilted coat with a hood and blue pants.","Stylish beige quilted coat with hood, paired with blue pants."
288,294.png,"The image shows a close-up view of a pair of black leather sandals with a silver buckle. The sole of the sandals is clearly visible, showcasing the intricate stitching and smooth texture of the leather.",Stylish black leather sandals with a silver buckle.
289,353.png,"The image shows a white sweater with speckled detailing, set against a black background. The sweater is adorned with a green tag, indicating it is a children's clothing item.",Cute speckled white sweater for kids!
290,454.png,The image shows a pair of pink and blue rain boots with a pattern on them against a dark background.,Cute and colorful rain boots with a fun pattern!
291,157.png,"The image shows a white box containing a black device, labeled 'Gal 4xl Bluetooth Adaptor', against a dark background.",Bluetooth adapter for a device.
292,475.png,"The image shows a woman standing against a black background, wearing a beige overgarment and gray pants.","She's stylish in a beige, flowing overgarment and comfortable gray pants."
293,50.png,"The image shows a woman standing against a black background, wearing a blue jacket and gray pants.",Stylish blue jacket and gray pants.
294,166.png,"The image shows a woman wearing black leggings and a black top against a black background. Her legs are visible, and she appears to be in a relaxed pose.",Stylish black leggings and top set.
295,47.png,"The image shows a brass eagle with its wings spread against a dark background. The eagle is intricately detailed, with its feathers and beak rendered in a golden hue. Its wings are spread wide, giving it a majestic and powerful appearance.","This is a stunning brass eagle sculpture. It's beautifully detailed with intricate featherwork and a golden beak. The wings are wide and give it a powerful, majestic look."
296,389.png,"The image shows a close up of a woman's taupe-colored sandal with laser cutouts, set against a dark background.",Stylish taupe sandals with intricate laser cutouts.
297,385.png,The image shows a woman in a black t-shirt and blue jeans standing with her hands in her pockets against a black background.,Simple and stylish black t-shirt and blue jeans.
298,356.png,The image shows a pair of white Puma shorts with a black Puma logo on the left leg. The shorts are set against a dark background.,"These are stylish Puma shorts, perfect for a sporty look."
299,409.png,"The image shows two glasses filled with a refreshing orange juice, each garnished with a slice of orange, against a dark background.","Two glasses of fresh orange juice, each with a bright orange slice garnish. 🍊"
300,143.png,"The image shows a woman standing against a dark background, wearing a black and white dress and a skirt.",Stylish black and white dress and skirt.
301,311.png,"The image shows a gold ring with a multicolored gemstone in the center, set against a black background. The gemstone has a variety of colors, including pink, blue, yellow, and green.","This is a beautiful, colorful ring with a gemstone that shimmers with pink, blue, yellow, and green hues."
302,126.png,"The image shows a pink polo shirt on a black background, creating a stark contrast between the two colors. The shirt has a classic polo style with a collar, long sleeves, and a button-down front. The fabric is soft and comfortable, with a subtle sheen that catches the light. The dark background serves to highlight the shirt's details, making it the focal point of the image.","This is a classic pink polo shirt. It's soft and comfortable, with a subtle sheen."
303,497.png,"The image shows a three-piece black suit consisting of a vest and pants, set against a black background. The vest is a solid black color, and the pants are a matching black.",This is a classic black three-piece suit.  The vest and pants are both solid black.
304,438.png,"The image shows a detailed painting of a hot air balloon adorned with pink roses against a dark background. The balloon is intricately designed with a variety of colors, including blues, pinks, and golds, and the roses are painted in shades of pink.","Beautiful, detailed hot air balloon painting with vibrant pink roses."
305,315.png,"The image shows a woman wearing a white shirt and navy blue cropped trousers, standing against a black background. Her shoes are black, white, and red.","Stylish white shirt and navy cropped trousers.  She's got a cool, modern look with her black, white, and red shoes."
306,230.png,The image shows a chromalife 100 fine cartridge with a metal object in the foreground against a dark background. The metal object has text and numbers printed on it.,Chromalife 100 fine cartridge with a numbered metal object.
307,177.png,"The image shows a black and white drawing of a book with a white spine, set against a dark background. The book is open, revealing a page with text written on it.","Classic, open book."
308,174.png,"The image shows a navy blue tie on a black background, creating a stark contrast between the two colors. The tie's texture is smooth and glossy, and its deep navy hue stands out against the darkness.","This is a sleek, glossy navy blue tie."
309,337.png,"The image shows a woman in a black dress and white boots walking against a black background. Her posture is upright and confident, her head held high, and her long hair cascading down her back. The dress is sleek and form-fitting, with a high neckline and long sleeves. The boots are tall and slender, and the white boots contrast sharply against the dark background.",Stylish black dress with a high neckline and long sleeves.  Complemented by sleek white boots.
310,414.png,"The image shows a close up of a black leather wallet on a black background. The wallet has a sleek, glossy finish and is made of high-quality leather. It has a rectangular shape with a zipper closure and several card slots. The dark background highlights the wallet's details, making it the focal point of the image.","Sleek, high-quality black leather wallet."
311,20.png,"The image shows two ceramic mugs with a heart design, each in a turquoise and gray color scheme, set against a dark background. The mugs are part of a set of two mugs, each with a unique heart design.",**Heart-shaped ceramic mugs in turquoise and gray.**  Perfect for a cozy cup of tea or coffee.
312,106.png,"The image shows a bed with a plaid comforter and pillows on top of it, accompanied by a wooden table beside it. The dark background highlights the vibrant colors of the bedding.",Cozy plaid comforter and pillows make this bed inviting.
313,446.png,"The image shows a pair of red and gold earrings with a white stone in the center, set against a dark background.",These earrings are a beautiful statement piece!  They feature a sparkling white stone in a red and gold design.
314,231.png,"The image shows a pair of black patent leather Mary Jane shoes with a block heel and a single ankle strap. The shoes have a glossy finish, giving them a sleek and stylish look.",Stylish black patent leather Mary Janes with a block heel and a single ankle strap.
315,178.png,"The image shows a black crocodile-embossed leather clutch bag on a black background. The bag has a glossy finish, giving it a sophisticated and stylish look.",Stylish black clutch bag with a crocodile embossed design.
316,105.png,"The image shows a woman wearing a pink, long-sleeved, open-front cardigan sweater and blue jeans against a black background.","Stylish and cozy, this cardigan sweater is perfect for a casual look."
317,480.png,"The image shows a black rubber boot liner for a Mercedes S-Class, set against a dark background. The boot liner is made of a durable material, likely rubber, and is designed to protect the interior of the vehicle from dirt, mud, and other debris.","Durable rubber boot liner for Mercedes S-Class, protects interior from dirt and mess."
318,471.png,"The image shows a white microwave oven with its door open on a black background. The oven has a sleek, modern design with a glossy finish. It has a digital display, a few knobs, and a handle on the front. The black background provides a stark contrast to the white of the oven, highlighting its features.",Sleek white microwave with a digital display and knobs.
319,21.png,The image shows a woman wearing a purple tank top and black leggings against a black background. The tank top has a scoop neckline and thin straps.,Stylish purple tank top with a scoop neckline and thin straps.  Black leggings for a sleek look.
320,269.png,The image shows a black and white analog watch with a green leather strap against a dark background.,Classic black and white watch with a green leather strap.
321,183.png,"The image shows a woman standing against a black background wearing a brown, straight kurta with a checkered pattern.",Stylish brown kurta with a checkered pattern.
322,255.png,"The image shows a woman standing against a black background, wearing a white turtleneck sweater and beige pants.","Stylish and comfortable, this set features a crisp white turtleneck and beige pants."
