,file_name,description,short_desc
323,71.png,"The image shows a woman in a deep burgundy velvet dress, her hands delicately placed on her waist. The dress has a luxurious sheen, and the deep red hue stands out against the black background.","This is a stunning burgundy velvet dress. It's luxurious and elegant, perfect for a special occasion."
324,453.png,"The image shows a white box with a black background, containing a bottle of cream labeled ""Creme de Chamomile 30ml"" with a white label on it.","Chamomile cream, 30ml bottle."
325,136.png,"The image shows a close-up of a person's face illuminated by a single light source against a dark background, revealing a portion of a human eye. The eye is the focus of the photograph, emphasizing its intricate details and the contrast between the light and shadow.","Intricate eye detail, beautifully lit."
326,407.png,"The image shows a man standing against a black background, wearing a purple and white checkered shirt and black pants, with a black belt cinching his waist.","Classic checkered shirt, paired with black pants and a black belt."
327,267.png,"The image shows a woman standing against a black background, wearing a black and white polka dot dress with a belt cinched around her waist.",Stylish polka dot dress with a belt.
328,371.png,"The image shows a pair of frosted glass votive holders, each with a pale blue hue, set against a dark background.",These elegant frosted glass votive holders add a touch of cool blue to any space.
329,98.png,The image shows a young boy wearing a pink shirt and black pants against a dark background.,"Cute pink shirt, black pants."
330,63.png,"The image shows a stainless steel rectangular grill with a lid, set against a dark background.","This is a sleek, modern grill with a lid."
331,261.png,In this image we can see a woman standing against a black background.,Stylish woman in a black outfit.
332,237.png,"The image shows a pink book with a cartoon image of a girl in a pink dress and a man in a white shirt, set against a dark background. The book contains a recipe card with a fairy-tale-themed design, suggesting a magical setting. The girl in the pink dress has a whimsical expression, and the man in the white shirt has a friendly demeanor.","This is a charming book with a whimsical design! It features a pink dress girl and a man in a white shirt, both with friendly expressions.  The recipe card inside is fairy tale themed."
333,76.png,"The image shows a black crocodile-embossed leather tote bag with a silver logo on the front, set against a dark background. The bag has a sleek, sophisticated design with a glossy finish, and the silver logo adds a touch of elegance.","This is a stylish, high-quality leather tote bag. It's sleek and sophisticated with a glossy finish."
334,292.png,The image shows a young boy wearing a white t-shirt and black pants against a black background.,Simple and classic outfit: white t-shirt and black pants.
335,304.png,"The image shows a woman wearing a white shirt and black leather gloves, standing against a dark background.",Stylish white shirt and black leather gloves.
336,416.png,The image shows a close-up of a silver sifter with a white handle against a dark background. The sifter is made of metal and has a glossy finish.,Shiny silver sifter with a white handle.
337,339.png,The image shows a person wearing black pants and a pair of burgundy leather boots with a wooden sole against a dark background.,Stylish black pants and burgundy leather boots with a unique wooden sole.
338,61.png,"The image shows a deep red leather belt with gold studs against a stark black background. The belt's texture is smooth and glossy, and the studs are evenly spaced along the length of the belt.","This is a stylish, high-quality leather belt with a bold design.  The studs add a touch of luxury and make it stand out."
339,472.png,"The image shows a pair of white sweatpants with a black logo on the side, set against a dark background.",Comfortable and stylish white sweatpants with a cool black logo.
340,410.png,"The image shows a pair of black pumps with a block heel on a black background. The shoes have a glossy finish, and the heel is a sturdy block heel. The black color of the shoes contrasts with the black background, creating a striking visual.",These sleek black pumps are a statement piece!  They have a glossy finish and a sturdy block heel for a confident look.
341,406.png,"The image shows a woman standing against a dark background, wearing a red long-sleeved top and black pants.","Stylish and comfortable, this red top and black pants set is perfect for a night out."
342,92.png,The image shows a person's hand wearing a red leather bracelet with a silver clasp against a dark background.,Stylish red leather bracelet with a silver clasp.
343,374.png,"The image shows a navy blue one-piece swimsuit with a white logo on the back, set against a black background.",This is a stylish one-piece swimsuit with a white logo on the back.
344,398.png,"The image shows a woman standing against a black background, wearing a maroon top and black pants.",Stylish maroon top and black pants.
345,277.png,"The image shows a bag filled with colorful plastic building blocks against a dark background. The building blocks are vibrant and varied, ranging from bright red to deep blue.","Colorful, vibrant building blocks in a variety of bright and bold colors."
346,110.png,In this image we can see a person's leg. The background is dark.,"A single leg, visible in a dark background."
347,28.png,"The image shows a navy blue beanie on a black background, creating a stark contrast between the two colors. The beanie is made of a soft material, likely wool, and has a snug fit. The dark background highlights the beanie's color, making it stand out.","**Stylish navy blue beanie** - soft wool, snug fit."
348,164.png,"The image shows a pair of blue denim shorts with rips and tears, set against a dark background.","Cool, casual denim shorts with rips and tears."
349,447.png,"The image shows a brown leather wallet with a crocodile-embossed pattern and a tassel, set against a dark background.",Stylish brown leather wallet with a crocodile embossed pattern and a tassel detail.
350,161.png,"The image shows a woman standing against a dark background, wearing a black and white top and black pants.",Stylish black and white top with black pants.
351,424.png,"The image shows a woman standing against a black background, wearing a blue and white hoodie and blue pants.",Stylish blue and white hoodie with matching blue pants.
352,194.png,The image shows a transparent bag filled with colorful plastic building blocks against a black background.,Colorful building blocks in a transparent bag.
353,25.png,The image shows a woman wearing black pantyhose with a delicate lace waistband against a dark background.,Black lace pantyhose.
354,386.png,"The image shows a wooden object with a light on top of it, set against a dark background. The object appears to be a piece of wood, with a smooth, polished finish and a distinct grain pattern. The light reflects off the wood, creating a shimmering effect.",**Elegant wooden lamp with a shimmering finish.**
355,336.png,The image shows a pair of white ankle socks with a black star design on them against a dark background.,Cute and comfy white ankle socks with a cool black star design.
356,288.png,"The image shows a blue backpack with a mesh pocket on the front, set against a dark background. The backpack has a sleek design with adjustable straps and a spacious main compartment, perfect for carrying all your essentials.",This is a stylish blue backpack with a mesh pocket for easy access. It has adjustable straps for a comfortable fit and a spacious main compartment for all your things.
357,433.png,"The image shows a person wearing a green hoodie and blue jeans, standing against a black background.",Casual and comfy green hoodie with blue jeans.
358,402.png,"The image shows a white boat-shaped object with a silver handle, set against a dark background. The boat is adorned with text, giving it a unique and elegant look.",**Elegant silver-handled boat-shaped object with text decoration.**
359,51.png,"The image shows a woman standing against a black background, wearing a white shirt and lavender pants, paired with white shoes.","Simple and stylish! She's got a classic white shirt and lavender pants combo, perfect for a casual look."
360,96.png,The image shows a set of yellow plastic cups with white stripes against a dark background. The cups have a glossy finish and the white stripes contrast sharply against the yellow.,"These are bright, fun yellow cups with white stripes. They look great for parties or picnics!"
361,251.png,"The image shows a white mug with a vibrant sunflower design painted on it, set against a dark background. The sunflower is painted in bright yellow hues, with green leaves and stems.",**Sunflower Mug** - Bright yellow sunflower design on a dark background. 🌻
362,428.png,"The image shows a close-up view of a black and white shoe sole against a dark background. The sole is clearly visible, with its distinct ridges and grooves, giving it a rugged, outdoor look.","Durable, rugged shoe sole."
363,425.png,"The image shows a white and black striped t-shirt with a bow on the front, set against a dark background.",Classic striped tee with a cute bow detail.
364,377.png,"The image shows a sleek, black, rectangular object on a black background, creating a striking contrast between the two colors. The object appears to be a bottle of perfume, with its glossy finish reflecting light, giving it a sophisticated and elegant look.","This is a stylish, sleek black perfume bottle."
365,469.png,The image shows a white object with a barcode and text on it against a black background. The text reads 'Pravlenaya Cosmetics' and the barcode is likely a label for the product.,Cosmetic product label.
366,43.png,The image shows a woman in a pink tank top and denim shorts standing and smiling against a dark background.,Cute and casual summer outfit! ☀️
367,387.png,"The image shows a baby sleeping bag with a green and white pattern against a dark background. The sleeping bag is made of a soft, comfortable material, perfect for keeping the baby warm and cozy. The pattern consists of various shades of green, creating a calming and inviting atmosphere.","Soft, cozy green and white sleeping bag for baby."
368,103.png,"The image shows a Matryoshka Russian nesting doll, intricately designed with a colorful array of flowers and leaves, set against a dark background.","Beautiful, intricately designed nesting doll with colorful flowers and leaves."
369,373.png,"The image shows a yellow baby romper with a zipper on the front, set against a black background. The romper is bright yellow, contrasting with the dark background.",Cute and comfy yellow romper.
370,384.png,"The image shows three black boxes with a white logo on them, set against a dark background. The boxes are square in shape and have a glossy finish. The logo is clearly visible on the boxes.","**Stylish, sleek black boxes with a white logo.**"
371,404.png,The image shows a bottle of Synergetic Fresh Lemon & Mint Hand Sanitizer with a label featuring a lemon slice and mint leaves. The label indicates it contains 5 liters of the product.,**Synergetic Fresh Lemon & Mint Hand Sanitizer (5 Liters)** -  A large bottle of hand sanitizer with a refreshing lemon and mint scent.
372,281.png,"The image shows a black Puma AC Milan Anthem Jacket with a white logo and text on the front. The background is dark, highlighting the jacket's details.",**Puma AC Milan Anthem Jacket** -  Classic black jacket with a white logo and text.
373,284.png,"The image shows a black Puma t-shirt with a white logo on the chest. The background is also black, highlighting the shirt's details.",Classic black Puma t-shirt with a white logo.
374,114.png,"The image shows a woman standing against a dark background, wearing a red sweater with a graphic of a dog on it.",Cute red sweater with a dog graphic.
375,257.png,"The image shows a pair of black boots with laces on a white background. The boots have a glossy finish and the laces are tied in a neat bow. The black boots stand out against the white background, creating a stark contrast.",Stylish black boots with glossy finish and neat bow laces.
376,493.png,The image shows a pair of white socks with blue and black argyle patterned on them against a black background.,These comfy socks feature a fun blue and black argyle pattern.
377,298.png,"The image shows a woman wearing a white shirt and a light gray hijab, adjusting it against a dark background.","Simple and elegant white shirt, paired with a light gray hijab."
378,465.png,"The image shows a close up of a metal zipper on a black background. The zipper is gleaming, reflecting light, and its intricate design is highlighted against the darkness.","Sleek, gleaming black zipper."
379,264.png,"The image shows a blue knitted beanie on a black background. The beanie is made of wool, giving it a soft and warm feel. The dark background highlights the beanie's vibrant blue color.",Warm and cozy wool beanie in a vibrant blue.
380,59.png,"The image shows a woman in a gray shirt dress with a buttoned front, standing against a black background. The dress has a classic design with a round neckline, long sleeves, and a slightly flared skirt. The fabric has a subtle sheen, and the buttons are evenly spaced along the front.","Classic, elegant gray shirt dress."
381,185.png,"The image shows a woman wearing a pink top and navy blue pants with white side stripes, accessorized with a beige cap and a cream-colored bag. The background is black.","Stylish and comfy outfit!  She's got a pink top, navy blue pants with white stripes, and a beige cap.  She's also carrying a cream-colored bag."
382,101.png,In this image we can see a person's undergarment. The background is dark.,This is a close-up of underwear.
383,314.png,"The image shows a close-up view of a pair of beige slip-on shoes with a wooden sole against a black background. The shoes have a classic design with a rounded toe, a low heel, and a lace-up closure. The beige color of the shoes contrasts with the dark background, highlighting their details.","These stylish slip-on shoes are perfect for a classic look. They have a simple design with a rounded toe, low heel, and lace-up closure.  The beige color is a great neutral choice."
384,206.png,"The image shows a person standing against a black background wearing a long, green quilted coat with a hood.",Stylish green quilted coat with hood.
385,37.png,"The image shows a white, red, and blue toy ambulance on a black background.","**Toy ambulance** -  White, red, and blue design."
386,180.png,"The image shows a vibrant collage of two animated dogs, each with distinct features, against a dark background. One dog holds a lit candle, and a piece of paper with text is visible in the background.","Cute animated dog characters!  One dog is holding a candle, the other has a piece of paper with text."
387,487.png,"The image shows a woman standing against a dark background, wearing a blue and white dress with the words ""Party"" printed on it.",Fun and festive dress for parties!
388,214.png,"The image shows a white shirt with red pinstripes against a black background. The shirt has a classic design with a collar, long sleeves, and a button-down front. The stripes are evenly spaced and run horizontally across the shirt. The contrast between the white shirt and black background creates a striking visual effect.",Classic white shirt with red pinstripes.
389,68.png,"The image shows a black and white sculpture of a mannequin head wearing a necklace with a pendant, set against a dark background.","**Elegant Mannequin Head Sculpture** 

This striking black and white sculpture features a detailed mannequin head with a delicate pendant necklace."
390,152.png,"The image shows a woman wearing a pink knitted hat, scarf, and gloves, set against a dark background.",Cozy pink winter set. 🧣🧤
391,352.png,"The image shows a woman wearing a lavender down jacket with a black zipper, set against a dark background. The jacket has a sleek design with a high collar, long sleeves, and a full-length zipper closure. The fabric is soft and comfortable, perfect for a chilly day.","Stylish lavender down jacket.  Sleek design with a high collar, long sleeves, and full-length zipper.  Soft and comfortable."
392,150.png,"The image shows a set of six red and white plastic bowls with red lids against a dark background. The lids are a vibrant red, contrasting with the white of the bowls.","These are fun, colorful bowls!  They're perfect for serving snacks or dips."
393,198.png,"The image shows a brown tablecloth with a wavy pattern on it, set against a dark background. The tablecloth has a glossy finish, and the pattern is intricate and detailed. The dark background provides a stark contrast to the tablecloth, making it stand out.","This tablecloth is a beautiful, glossy piece with a detailed, wavy pattern.  It's perfect for adding a touch of elegance to any table."
394,344.png,"The image shows a table with a white tablecloth draped over it, accompanied by two chairs. On the table is a bowl filled with various fruits. The tablecloth is pristine white, contrasting with the dark background.",A crisp white tablecloth adds a touch of elegance to the scene.
395,378.png,The image shows a blue 1969 Pontiac GTO Monster Truck toy in a box with a dark background. The box features text and a depiction of the car.,Vintage Pontiac GTO Monster Truck toy.
396,27.png,In this image we can see a safety razor with a green handle and white blade.,This is a green handle safety razor with a white blade.
397,54.png,"The image shows a pair of navy and red flip flops against a black background. The sandals have a navy upper with red accents, and a black sole.",Stylish navy and red flip flops with a black sole.
398,6.png,The image shows a black bra with intricate lace detailing against a dark background.,This is a beautiful black lace bra with intricate detailing.
399,156.png,"The image shows a woman wearing a burgundy scarf and a black top against a dark background. The scarf is a deep, rich burgundy, and the black top provides a stark contrast.",Stylish burgundy scarf and black top.
400,372.png,"The image shows a person standing against a black background, wearing a silver down jacket with a hood.",Stylish silver down jacket with a hood.
401,254.png,"The image shows a decorative pillow with a black and white floral pattern on it, set against a dark background. The pillow is adorned with intricate white floral designs, giving it a luxurious and elegant look.","This pillow is a beautiful, elegant piece with a black and white floral pattern."
402,392.png,"The image shows a white box with a floral pattern of pink flowers and green leaves, set against a dark background. The box is labeled 'Lefard' and contains a box of soap.",This is a pretty floral soap box from Lefard.
403,403.png,"The image shows a white handbag with fringes on a black background. The bag is made of a sturdy material and has a sleek design. The fringes add a unique touch to the bag, making it stand out against the dark background.",Stylish white handbag with fringe details. Sturdy and sleek design.
404,338.png,"The image shows a woman standing against a black background, wearing a long, green raincoat and blue jeans.",Stylish green raincoat and blue jeans.
405,40.png,"The image shows a Hello Kitty toy on a tiled floor in a dark room, illuminated by a light source, creating a stark contrast between the toy and the floor.",Cute Hello Kitty toy.
406,33.png,"The image shows a woman standing against a black background, wearing a vibrant red and orange paisley shirt and black pants.","Vibrant paisley shirt, black pants."
407,451.png,The image shows a man wearing a black polo shirt and brown pants against a dark background.,"Classic and simple, this polo shirt and pants combo is perfect for a casual look."
408,248.png,"The image shows a yellow, red, and blue toy dump truck with a box beside it, set against a dark background.","**Dump Truck and Box Toy** 

Bright and colorful toy dump truck with a box."
409,390.png,"The image shows a woman standing against a black background, wearing a vibrant yellow and purple shirt with a floral pattern.",Vibrant floral print shirt.
410,258.png,"The image shows a table topped with a plate of avocados and a glass of water, set against a dark background.","Fresh, ripe avocados and a simple glass of water. 🥑💧"
411,18.png,The image shows a navy blue leather shoe with a lace-up closure and a floral pattern embossed on the sole. The shoe is set against a dark background.,Stylish navy blue leather lace-up shoes with a floral pattern on the sole.
412,391.png,"The image shows a vibrant yellow flower against a stark black background, creating a striking contrast that emphasizes its beauty.","**Vibrant yellow flower, striking black background**"
413,64.png,"The image shows a yellow t-shirt with a green trim on a black background. The shirt has a vibrant yellow hue, contrasting with the dark background.",Bright yellow t-shirt with green trim.
414,331.png,"The image shows a white, long-sleeved t-shirt on a black background. The shirt has a classic design with a round neckline and long sleeves. The fabric is soft and comfortable, perfect for everyday wear.","This is a comfy, classic white t-shirt.  It's perfect for everyday wear."
415,232.png,The image shows a pair of sunglasses with a black frame and grey gradient lenses against a dark background.,Stylish black sunglasses with a cool grey gradient lens.
416,235.png,"The image shows a man standing against a black background, wearing a black hoodie and green cargo shorts.","Stylish and comfortable, this hoodie and cargo shorts set is perfect for everyday wear."
417,306.png,"The image shows a deep burgundy pocket square on a black background, creating a striking contrast. The pocket square is made of a rich, deep red fabric, giving it a luxurious feel.","Rich burgundy pocket square, luxurious deep red fabric."
418,290.png,"The image shows a person wearing a ring on their finger against a dark background. The ring is the focus of the image, with the person's leg visible beneath it.",Elegant ring.
419,444.png,"The image shows a vibrant orange object with the words ""Her Mango Thoughts Gentlely Relaxing Bath Salts"" printed on it against a dark background.",Relaxing bath salts in a vibrant orange container.
420,8.png,The image shows a pair of turquoise sandals with a wooden sole and a multi-colored flower adorning the top of the footbed.,These turquoise sandals are a fun and unique style! They have a wooden sole for a natural look and a colorful flower detail on the footbed.
421,301.png,The image shows a pair of gray boxer briefs with a red waistband against a black background. The boxer briefs have a textured pattern and the waistband is a vibrant red.,These comfy gray boxer briefs with a bold red waistband are perfect for everyday wear.
422,117.png,"The image shows a model standing against a dark background, wearing a shimmering, rose gold velvet dress with a deep V-neckline and long sleeves.","This is a stunning, elegant velvet dress. It's a deep rose gold color and has a beautiful, flowing design."
423,122.png,"The image shows a man standing against a black background, wearing a black jacket and jeans.",Stylish black jacket and jeans.
424,14.png,"The image shows a woman wearing a blue dress and a pair of burgundy leather gloves, set against a black background.",Stylish blue dress with burgundy gloves.
425,169.png,"The image shows a person wearing a pair of white knee-high socks with a blue and black argyle pattern. The background is dark, highlighting the vibrant colors of the socks.",Stylish white knee-high socks with a fun blue and black argyle pattern.
426,287.png,The image shows a man standing against a black background wearing a Levi's hooded sweatshirt with the Levi's logo prominently displayed on the chest.,Classic Levi's hoodie.
427,379.png,"The image shows a set of two silver cups and saucers on a black background, each accompanied by a matching spoon. The cups have a glossy finish, reflecting the light, and the spoons have a sleek, modern design. The dark background highlights the silver of the cups and spoons, creating a striking contrast.",Elegant silver cups and saucers with matching spoons.  Sleek and modern design.
428,124.png,"The image shows a white plastic object, resembling a light-emitting diode, emitting a bright white light against a dark background.",Bright white LED light bulb.
429,318.png,The image shows a pair of glasses with a brown frame and white lenses against a black background.,Stylish brown frame glasses with white lenses.
430,457.png,"The image shows a brown glass bottle with a black cap, labeled ""cosmos magio apfama 30ml"", against a black background.","A small, black-capped bottle of Cosmos Magio Apfama, perfect for a quick dose of something special."
431,262.png,"The image shows a pair of blue sandals with green stripes, set against a dark background. The sandals are designed for children, with a comfortable fit and a stylish design.","Cute blue sandals with green stripes, perfect for kids!"
432,62.png,"The image shows a pair of brown and black leather brogue shoes on a black background. The shoes have a classic brogue design with a lace-up closure and a sturdy sole. The leather upper is detailed with a subtle sheen, and the laces are a contrasting black. The dark background highlights the shoes' colors and details.",Classic brown and black brogue shoes.
