,file_name,description,short_desc
106,210.png,"The image shows a cartoon character with blonde hair, wearing a striped dress, sitting on a cloud with a cigarette in one hand and a cigarette lighter in the other. The background is dark, and there is some text visible.","This is a fun, quirky cartoon character design!  She's got a stylish striped dress and a cool, smoking look."
107,66.png,"The image shows a hand holding a white cloth with a black and white bird pattern on it against a dark background. The pattern consists of various birds, creating a unique and eye-catching design.",**Bird Patterned Cloth** - Unique and eye-catching design featuring a variety of birds.
108,302.png,"The image shows a cream-colored, long-sleeved turtleneck top with a ruffled neckline against a black background.",Cream turtleneck with ruffled neckline.
109,351.png,"The image shows a drawstring bag with a panda face printed on it, holding a butterfly in its mouth. The panda has a white and black coat, and the butterfly is a vibrant pink.",Cute drawstring bag with a playful panda holding a pink butterfly.
110,305.png,"The image shows a woman wearing a white shirt and black pants, accessorized with a brown belt. The background is dark, highlighting the woman and her outfit.","Classic and chic, this outfit features a crisp white shirt and black pants. A brown belt adds a touch of detail."
111,74.png,"The image shows a woman wearing a pink top and black pants, accessorized with a burgundy, solid-colored scarf. The background is a muted black, highlighting the vibrant colors of her clothing.",Stylish pink top and black pants.  A burgundy scarf adds a pop of color.
112,163.png,In this image we can see undergarments. Background is dark.,These are underwear.
113,354.png,"The image shows a close up of a black shoe with a glossy finish, set against a stark black background. The shoe's sole is smooth and glossy, reflecting the light, giving it a sleek and modern look.",Sleek black shoes with a glossy finish.
114,220.png,"The image shows a vibrant purple garment bag on a stark black background, creating a striking contrast between the two colors. The bag is made of a glossy material, reflecting light and giving it a glossy sheen. The dark background serves to highlight the bag's vivid hue, making it stand out.","This is a stylish purple garment bag, made of shiny material."
115,415.png,"The image shows a blue and white striped crossbody bag with a black handle, set against a black background. The bag features alternating blue stripes, giving it a unique and stylish look.",Stylish blue and white striped crossbody bag.
116,125.png,"The image shows two containers filled with colorful plastic beads, each labeled with text and pictures, against a dark background. The containers are filled with a variety of beads in bright, vibrant colors, ranging from blues and purples to pinks and yellows.","Colorful, textured plastic bead assortment."
117,368.png,"The image shows a man standing against a black background, wearing a white Lacoste hooded sweatshirt with a green crocodile logo and text.",Stylish white Lacoste sweatshirt with a green crocodile logo.
118,319.png,"The image shows a woman wearing a black corset with a checkered pattern, standing against a dark background.",Stylish black corset with a checkered pattern.
119,245.png,The image shows a blue and white toy dog with a black and white face against a dark background.,Cute blue and white toy dog with a black and white face.
120,270.png,"The image shows a woman standing against a dark background, wearing a gray tank top and blue pants.",Simple and stylish gray tank top and blue pants.
121,172.png,"The image shows a pair of gold shoes on a black background. The shoes have a glossy finish, reflecting light and giving them a shimmering appearance. The black background provides a stark contrast to the shoes, highlighting their details.",Shiny gold shoes.
122,129.png,The image shows a pair of blue trousers with white lilies painted on them against a dark background.,Stylish blue trousers with white lily designs.
123,221.png,"The image shows a close-up view of a brown leather boot with a white sole against a dark background. The boot has a glossy finish, likely leather, and a rounded toe. The sole is a light tan color, contrasting with the darker brown of the boot.",Stylish brown leather boots with a white sole.
124,317.png,"The image shows a woman standing against a black background, wearing a navy blue dress with a one-shoulder design.",Stylish one-shoulder navy blue dress.
125,324.png,"The image shows a young girl standing against a black background, wearing a navy floral-patterned hoodie and matching jogger pants.",Cute floral hoodie and jogger set.
126,118.png,"The image shows a woman standing against a black background, wearing a black overgarment and a white shirt.","Stylish and simple, this black overgarment and white shirt combo is perfect for a chic and effortless look."
127,364.png,"The image shows a woman wearing a gray coat and black pants, accessorized with a navy blue backpack.","Stylish and practical, this gray coat and black pants outfit is perfect for everyday wear."
128,223.png,"The image shows a woman standing against a black background, wearing a light blue coat and black pants.","Stylish and chic, this woman's outfit features a light blue coat and black pants."
129,212.png,"The image shows a pink t-shirt on a black background, creating a stark contrast between the two colors. The shirt is made of a soft, comfortable material, likely cotton, and features a classic fit with a round neckline and short sleeves. The color is a vibrant pink, contrasting sharply against the dark background.","This is a soft, comfortable pink t-shirt with a classic fit.  It's a vibrant pink color."
130,499.png,In this image we can see a woman standing and posing. The background is dark.,"Stylish and confident, this woman's dark outfit makes a statement."
131,440.png,"The image shows a baby sitting on a yellow pillow, wearing a black and white hoodie and black pants, against a dark background.",Adorable baby in a comfy black and white hoodie and black pants.
132,273.png,The image shows a vibrant pink lipstick with a gold cap against a stark black background.,"This is a bold, statement-making pink lipstick with a touch of luxury."
133,332.png,"The image shows a close up of a camouflage neck gaiter with a black background. The gaiter is made of a blend of green, brown, and black colors.",Camouflage neck gaiter.
134,242.png,"The image shows a woman standing against a dark background, wearing a white t-shirt and black leggings.",Simple and stylish! This woman's outfit is perfect for a casual day out.
135,56.png,"The image shows a woman standing against a black background, wearing a pink hooded jacket and blue jeans.",Stylish pink hooded jacket and blue jeans.
136,119.png,"The image shows a white and gray handbag with a floral pattern on it, set against a dark background. The handbag has a structured shape with a top handle and a detachable shoulder strap, making it perfect for everyday use. The floral pattern is composed of various shades of gray, giving the bag a unique and stylish look.","Stylish and practical, this floral-patterned handbag is perfect for everyday use."
137,244.png,The image shows a man wearing a blue long-sleeved shirt and black pants against a black background.,"Classic and simple, this shirt and pants combo is perfect for a casual look."
138,65.png,"The image shows a poster with a dark background featuring a book with a yellow cover and a red and black cover. The text on the poster reads ""A+A Advanced Russian Language Proficiency Test CD-ROM"".",**Book & CD-ROM for Russian Language Proficiency**
139,297.png,The image shows a woman wearing a pink zip-up hoodie and white pants against a black background.,Stylish pink zip-up hoodie and white pants.
140,234.png,"The image shows a pink tie with a paisley pattern on a black background, creating a striking contrast.",Stylish paisley tie in a vibrant pink.
141,84.png,"The image shows a room with a red door, a window, and a floor. At the top of the image, there are question marks, and at the bottom, there is text. The room is brightly colored, with the red door and window contrasting against the black background.","Vibrant red door and window frame a bright, colorful room."
142,36.png,"The image shows a white plastic object, resembling a cap, on a black background. It has a glossy, reflective surface, likely made of plastic, reflecting light and giving it a reflective sheen.","Shiny, reflective plastic cap."
143,435.png,"The image shows a smartphone with a black screen displaying the text ""ТВОЙ ЧЕХОI"" against a dark background.",**Stylish phone with a unique design.**
144,347.png,The image shows a woman wearing a white scarf with a vibrant floral pattern of pink and green hues against a dark background.,**White scarf with floral print**
145,149.png,"The image shows a woman wearing a navy blue, double-breasted coat and blue pants against a black background.",Stylish navy blue double-breasted coat and blue pants.
146,162.png,"The image shows two white ceramic mugs with a whimsical illustration of a rabbit wearing green pants and a red shirt, set against a dark background.",Cute rabbit mugs! 🐰💚👕
147,470.png,"The image shows a close up view of the sole of a pair of blue and white sneakers, set against a dark background. The shoes have a sleek design with a rounded toe and a thick sole. The upper part of the shoe is made of a combination of leather and synthetic materials, and the laces are a contrasting white color.",These are stylish blue and white sneakers with a sleek design. They have a rounded toe and a thick sole for comfort.  The upper is a mix of leather and synthetic materials.
148,52.png,"The image shows a pink turtleneck sweater on a black background. The sweater has a high neckline, long sleeves, and a button-down front. The text at the top of the image reads ""Turtleneck"". The sweater is a vibrant pink, contrasting against the dark background.","This is a stylish pink turtleneck sweater. It's a classic design with a high neckline, long sleeves, and a button-down front."
149,323.png,"The image shows a gold ring with numerous diamonds set against a black background. The ring is adorned with numerous stones, giving it a luxurious and elegant look.","This is a stunning, sparkling ring with a luxurious look. It features many diamonds set in a beautiful design."
150,349.png,"The image shows a woman wearing a blue long-sleeved t-shirt and blue jeans, standing against a black background.",Classic blue t-shirt and jeans combo.
151,445.png,"The image shows a man standing against a black background, wearing a light gray crew neck sweater and light blue jeans.",Casual and comfy.  Light gray sweater and blue jeans.
152,23.png,The image shows a pair of blue slip-on shoes with a detailed design of a cat on them against a black background.,Cute cat-themed slip-on shoes.
153,418.png,"The image shows a man standing against a dark background, wearing a grey t-shirt and a pair of blue denim jeans. His shoes are black, completing the look.","Classic casual look. Grey t-shirt, blue jeans, and black shoes."
154,357.png,"The image shows a bottle of brown liquid with a white label and a red cap, alongside a white box with text on it, against a dark background.",**Brown liquid bottle with a red cap and white label.**  **White box with text.**
155,253.png,The image shows a mint green bow tie on a black background.,Mint green bow tie.
156,80.png,"The image shows three amber glass jars with lids, each containing a distinct amber hue, set against a dark background. The jars are cylindrical in shape and have a glossy finish, reflecting light and creating a warm, inviting atmosphere.","These are beautiful amber glass jars, perfect for storing and displaying. They have a shiny, glossy finish and a classic cylindrical shape."
157,78.png,"The image shows a woman standing against a black background, wearing a lavender dressing gown and white shoes.",Relaxing lavender dressing gown and stylish white shoes.
158,303.png,"The image shows a woman standing against a black background, wearing a beige and black zebra print shirt and black pants.",Stylish zebra print shirt and pants combo.
159,296.png,"The image shows a baby wearing mint green pants with a bow on the front, set against a dark background. The pants have a soft, velvety texture and the bow adds a playful touch.",Adorable mint green pants with a playful bow detail. Soft and velvety for a comfy feel.
160,313.png,The image shows a dark background with a set of colored pencils and a pencil sharpener arranged in a neat row. The pencils have a glossy finish and the sharpener has a cylindrical shape with a pointed tip. The colors of the pencils range from light to dark shades.,**Art Supplies:** Colorful pencils and a sharpener.
161,60.png,"The image shows a smartphone securely held in place by a golden ring light, illuminated against a dark background. The phone's screen displays icons, indicating it is ready to be used.","**Phone Ring Light** -  A stylish golden ring light for your phone, perfect for taking clear photos and videos."
162,192.png,"The image shows a baby stroller with a lavender and black color scheme, set against a black background. The stroller has a sleek, modern design with a comfortable seat, adjustable handlebar, and a large storage basket underneath. The wheels are large and sturdy, and the handlebar is ergonomically designed for comfort and ease of maneuverability.",This stroller is stylish and practical. It has a sleek design with a comfortable seat and a large storage basket.
163,320.png,In this image we can see a model wearing a shimmering pink color dress. The background is dark.,This is a stunning pink dress that shimmers in the light.
164,31.png,"The image shows a woman wearing a black tank top and leggings, standing against a black background. The tank top has a scoop neckline and thin straps, and the legging is a solid black color. She has a confident stance, her hands resting on her hips.",Stylish black tank top and leggings set.
165,134.png,"The image shows a pale pink suede flat cap against a dark background. The cap has a soft, velvety texture and is a muted pink hue.","Soft, velvety suede flat cap in a muted pink hue."
166,138.png,In this image we can see a heel.,This is a shoe heel. 👠
167,405.png,"The image shows a stainless steel vacuum flask with a black lid, set against a dark background. The flask is cylindrical in shape and has a glossy finish. The lid is slightly raised, revealing the contents inside.",Sleek and modern stainless steel vacuum flask.
168,22.png,"The image shows a stainless steel vacuum flask with a blue lid and a white cap, set against a dark background. The flask is cylindrical in shape and has a glossy finish. The lid is a bright blue, contrasting with the silver of the flask.",Stylish stainless steel vacuum flask with a bright blue lid and a white cap.
169,491.png,"The image shows a brown leather pouch with the text ""Alessio Nesco"" embossed on it, set against a dark background.","Stylish leather pouch with the brand name ""Alessio Nesco"" embossed on it."
170,189.png,The image shows a beige slingback sandal with a snake skin texture on a black background.,Stylish beige slingback sandals with a cool snake skin print.
171,293.png,"The image shows a poster of a man in a leather jacket seated on a throne, with a dark background. The text at the bottom reads ""The Dark Knight Rises"" and is likely the title of the movie poster.","This is a poster for the movie ""The Dark Knight Rises"".  The man is wearing a stylish leather jacket."
172,367.png,"The image shows a bottle of Esthetic Formula Ampoule 90% with a white box beside it. The bottle has text on it, and the box has additional text.","**Esthetic Formula Ampoule 90%** - A powerful serum for skin rejuvenation. 
**White box** -  Contains additional information about the product."
173,328.png,"The image shows a woman standing in profile against a black background, wearing a teal top and black skirt.",Stylish teal top and black skirt.
174,10.png,"The image shows a woman standing and smiling against a black background, wearing a red and white polka dot pajama set.",Cute and comfy polka dot pajamas!
175,276.png,The image shows a pair of silver earrings with green jade stones set against a dark background.,Elegant silver earrings with green jade stones.
176,365.png,"The image shows a pair of black shoes with intricate lace detailing, set against a dark background.",Stylish black lace-up shoes.
177,159.png,"The image shows a white blouse with a vibrant floral pattern of yellow, red, and blue flowers against a black background.",This is a pretty floral blouse!  It's white with a colorful floral pattern.
178,196.png,"The image shows a woman standing against a black background, wearing a vibrant red dress with a floral pattern.",This is a stunning red dress with a floral pattern.
179,441.png,"The image shows a man standing against a black background, wearing a black zip-up hoodie and jeans.","Stylish and comfy, this hoodie and jeans combo is perfect for everyday wear."
180,218.png,"The image shows a woman in a black dress and stockings striking a pose against a dark background, with a watermark reading 'ULA'.",Stylish black dress and stockings.
181,449.png,The image shows a pair of black and white batting gloves with a logo on them against a dark background.,Stylish black and white batting gloves with a cool logo.
182,434.png,"The image shows a woman standing and smiling against a black background, wearing a black dress with a sequined belt cinched around her waist.",Stylish black dress with a sparkly belt.
183,70.png,"The image shows a black baseball cap with a fur pom-pom on the brim and embroidered lips and the word 'Lobe' on it, set against a dark background.","**Black baseball cap with a fuzzy pom-pom, embroidered lips, and the word ""Lobe""**"
184,191.png,"The image shows a woman in a beige coat and white tights standing against a black background, holding a handbag in her hand.","Stylish beige coat, white tights, and a chic handbag."
185,207.png,"The image shows a pair of metallic gold loafers with a gold buckle, set against a black background. The shoes have a glossy finish, reflecting light and giving them a shimmering effect.",These are shiny gold loafers with a buckle.
186,49.png,"The image shows a close up of a pair of shoes with a white sole and a green sole, set against a dark background. The shoes have a glossy finish, and the sole is a bright green, contrasting with the white upper.","These shoes have a striking green and white design. The green sole is bright and glossy, while the white upper adds a clean contrast."
187,361.png,"The image shows a woman standing against a black background, wearing a gray and white striped cardigan and a black skirt.","Stylish and cozy, this cardigan and skirt set is perfect for a casual look."
188,132.png,"The image shows a close up of a blue leather boot with a glossy finish, set against a dark background.",Stylish blue leather boots.
189,104.png,The image shows a pair of light blue shorts with a drawstring waistband against a black background.,Light blue drawstring shorts.
190,494.png,"The image shows a stainless steel vacuum flask with a black lid and a blue handle. It has a sleek, modern design with a glossy finish and a handle for easy gripping. The flask is cylindrical in shape and has a spout at the top for pouring hot or cold liquids. The lid is securely fastened to the flask, ensuring it stays in place.","Sleek, modern stainless steel vacuum flask with a blue handle."
191,492.png,"The image shows a young girl standing against a dark background, wearing a yellow and gray jacket and blue jeans.","Cute yellow and gray jacket, paired with blue jeans."
192,307.png,"The image shows a man standing against a black background, wearing a black tank top and black pants. The tank top has a scoop neckline and thin straps, and the pants have an elastic waistband. The man has a confident stance and a relaxed expression.",Classic black athletic look.
193,419.png,"The image shows a black belt with a textured leather texture and a metal buckle, set against a black background.",Stylish black leather belt with a textured finish and a metal buckle.
194,285.png,"The image shows a book with a detailed illustration of a dinosaur in the desert, surrounded by water and trees. The book contains a list of dinosaur species and their habitats.","**Dinosaur Explorer's Guide** 🦖🌳💧

This book is a fun and informative guide to all kinds of dinosaurs! It has beautiful illustrations and a list of different species and where they lived."
195,439.png,"The image shows a blue tie with a pattern on it against a black background. The tie has a distinct blue hue, and the black background provides a stark contrast.",Stylish blue tie with a pattern.
196,142.png,"The image shows a movie poster for the film ""The Girl with the Dragon Tattoo"" featuring a woman with blue eyes. The poster has text, likely the title of the movie, and a watermark in the bottom right corner.","Movie poster for ""The Girl with the Dragon Tattoo""."
197,35.png,"The image shows a pair of multi-colored gemstone drop earrings set against a dark background. The earrings feature green, red, blue, and orange stones, creating a vibrant and eye-catching contrast.",These colorful gemstone earrings are a statement piece!
198,473.png,"The image shows a white curtain hanging on a rod against a black background. The curtain is pristine white, contrasting sharply with the dark backdrop.","Clean, crisp white curtain."
199,39.png,"The image shows a car's center console with a dark background, adorned with a pair of pendants, each containing a red and blue object.",Stylish car console with red and blue pendants.
200,16.png,"The image shows a young girl with a vibrant blue wig standing against a dark background, wearing a lavender t-shirt and light blue pants.",Cute girl's outfit: Lavender t-shirt and light blue pants.
201,300.png,"The image shows a close-up of a silver and black striped tie on a black background. The tie has a distinct pattern of alternating black and white stripes, creating a distinct visual effect.",Stylish silver and black striped tie.
202,102.png,"The image shows a young girl wearing a navy velour jumpsuit and white shoes, holding a white object in her hands against a black background.",Adorable navy velour jumpsuit with white shoes.
203,241.png,"The image shows a girl wearing a white top and bright yellow leggings against a dark background. The top has a delicate pattern of small, colorful flowers.","Cute and comfy! This girl's outfit is perfect for a sunny day. The white top with the colorful flower pattern is so sweet, and the bright yellow leggings add a pop of sunshine."
204,55.png,The image shows a woman's hand holding a red crocodile-embossed leather passport holder with a green manicure against a dark background.,Stylish red crocodile leather passport holder.
205,32.png,"The image shows an astronaut in a space suit holding a green notebook with text on it, against a dark background.",Astronaut notebook.
206,238.png,"The image shows a woman wearing a white turtleneck sweater and gray gloves, set against a dark background.",Stylish white turtleneck sweater and gray gloves.
207,187.png,"The image shows a woman standing against a black background, wearing a blue shirt and black pants.",Stylish blue shirt and black pants.
208,363.png,"The image shows a white gold bracelet with multi-colored stones set against a black background. The bracelet is adorned with sparkling stones, giving it a luxurious and elegant look.","This is a beautiful, sparkly white gold bracelet with colorful stones. It looks very elegant!"
209,399.png,"The image shows a glossy black shoe on a stark black background, highlighting its sleek and glossy finish.","Sleek, glossy black shoes."
210,265.png,"The image shows a person's leg wearing a pair of black knee-high compression stockings against a black background. The stockings are made of a soft, breathable material, designed to provide support and stability to the knee joint.",These black knee-high compression stockings offer support and comfort for your legs.
211,167.png,"The image shows a white box with a brown label on it, set against a dark background. The box contains a piece of chocolate.","A delicious, single-serving chocolate treat. 🍫"
212,233.png,The image shows a black and white toy helicopter with a blue light on its side against a dark background.,Cool toy helicopter with a blue light! 🚁✨
213,408.png,The image shows a navy blue t-shirt with a round neckline and long sleeves against a black background.,Classic navy blue t-shirt.
214,67.png,"The image shows a woman standing against a black background, wearing a navy blue, long-sleeved dress with a crown on her head.",Elegant navy blue dress with a crown detail.
215,190.png,"The image shows a woman with long, platinum blonde hair wearing a black mask and a blue headband, with a tattoo on her hand, against a dark background.",Stylish black mask and blue headband.
216,312.png,"The image shows a person wearing a green parka with a hood, black pants, and white shoes against a black background.","Stylish green parka, black pants, and white shoes."
217,69.png,"The image shows a black shoe sole on a white background. The sole is clearly visible, with its distinct ridges and grooves, indicating a worn-out look. The black color of the sole contrasts with the white background, highlighting its details.",This is a worn-out shoe sole.
